{
  "version": 1,
  "id": "20260911T181012290Z-a496a812",
  "sourceRunId": "20260911T180837237Z-b5a62c25",
  "sourceReportHash": "69a65997bc648dc14c5984c487c3f00c5afe680e7c37639a18093ca36e4f75e1",
  "implementationFingerprint": {
    "src/synopsis.ts": "a1fd4d2a0430b95901e03d59d1fd06b6df41d38c5dede67d673a855b319c4f08",
    "src/review.ts": "cc4a8177ba5b5cd53ae34cf44b109da2b04f38415f7a5e246860406f452134c9",
    "src/evidence.ts": "d0a3ecd37787fef1f9b9744d0f83cae0c1fe2a60ba4395589049c969a16569a2",
    "src/inference.ts": "8f212d1a3bc5c262cf25a7818b23e69632d27b6fedddb9e969b0e2c8f76acd2c",
    "src/ledger.ts": "ed6ca75e804700168fdff59f0acdf74019c1cacc75323b0f5140197f96283620",
    "src/chain.ts": "59cf3d729ff7047ca254574cbbd889130e4c41b12672db3fcfee0312872b5917",
    "src/config.ts": "b596853cbcee0e197362720ef2bf7196cc92c9c8d49c63761ebf80926377d2e3",
    "src/types.ts": "9820f264cb493a027481a59adc0befda7f036d970f70d15862d70b7ea255c152",
    "scripts/build-synopses.ts": "51fc0bbb260c571921c47d7f1ca4507dd953f298bb87f0600fbc3ae8020a24ab",
    "package-lock.json": "50d026886293891ffb7bde1e9385065826560a2da8fbd9e94928f50fd1ae03db"
  },
  "example": "comparison",
  "mode": "fixture",
  "startedAt": "2026-09-11T18:10:12.414Z",
  "status": "succeeded",
  "calls": [
    {
      "id": "d96b0e04-0c65-4a7c-9f70-3b95d6740458",
      "agentId": "comparison/master",
      "purpose": "review",
      "requestedModel": "fixture (no inference)",
      "startedAt": "2026-09-11T18:10:12.415Z",
      "finishedAt": "2026-09-11T18:10:12.415Z",
      "status": "succeeded",
      "authorizationIds": []
    },
    {
      "id": "bf5c6d56-9c16-4231-8fb7-8c0768255a41",
      "agentId": "comparison/master",
      "purpose": "synthesize",
      "requestedModel": "fixture (no inference)",
      "startedAt": "2026-09-11T18:10:12.423Z",
      "finishedAt": "2026-09-11T18:10:12.423Z",
      "status": "succeeded",
      "authorizationIds": []
    },
    {
      "id": "3ea1e62a-cea1-43fe-8074-a42022eb6156",
      "agentId": "comparison/master",
      "purpose": "review",
      "requestedModel": "fixture (no inference)",
      "startedAt": "2026-09-11T18:10:12.441Z",
      "finishedAt": "2026-09-11T18:10:12.441Z",
      "status": "succeeded",
      "authorizationIds": []
    }
  ],
  "payments": [],
  "validationIssues": [],
  "output": {
    "summary": "Offline fixture synopsis. This text checks the final-answer layout and orchestration; it is not a researched recommendation.",
    "synopsis": [
      {
        "heading": "Decision summary",
        "body": "This section is synthetic fixture content. A live master agent would turn the cited child findings into a readable answer for this part of the command, explain the practical implications, and identify any information the available evidence could not establish.",
        "citations": [
          {
            "sourceId": "neon-docs",
            "startLine": 1,
            "endLine": 1
          }
        ]
      },
      {
        "heading": "Neon",
        "body": "This section is synthetic fixture content. A live master agent would turn the cited child findings into a readable answer for this part of the command, explain the practical implications, and identify any information the available evidence could not establish.",
        "citations": [
          {
            "sourceId": "neon-docs",
            "startLine": 1,
            "endLine": 1
          }
        ]
      },
      {
        "heading": "Turso",
        "body": "This section is synthetic fixture content. A live master agent would turn the cited child findings into a readable answer for this part of the command, explain the practical implications, and identify any information the available evidence could not establish.",
        "citations": [
          {
            "sourceId": "neon-docs",
            "startLine": 1,
            "endLine": 1
          }
        ]
      },
      {
        "heading": "PlanetScale",
        "body": "This section is synthetic fixture content. A live master agent would turn the cited child findings into a readable answer for this part of the command, explain the practical implications, and identify any information the available evidence could not establish.",
        "citations": [
          {
            "sourceId": "neon-docs",
            "startLine": 1,
            "endLine": 1
          }
        ]
      },
      {
        "heading": "Pricing and limits",
        "body": "This section is synthetic fixture content. A live master agent would turn the cited child findings into a readable answer for this part of the command, explain the practical implications, and identify any information the available evidence could not establish.",
        "citations": [
          {
            "sourceId": "neon-docs",
            "startLine": 1,
            "endLine": 1
          }
        ]
      }
    ],
    "completion": "partial",
    "findings": [
      {
        "claim": "Synthetic fixture evidence for Neon documentation.",
        "citations": [
          {
            "sourceId": "neon-docs",
            "startLine": 1,
            "endLine": 1
          }
        ],
        "assessment": {
          "verdict": "supported",
          "reason": "Explicitly labeled synthetic fixture content.",
          "method": "fixture",
          "callId": "d96b0e04-0c65-4a7c-9f70-3b95d6740458",
          "checkedAt": "2026-09-11T18:10:12.423Z",
          "claimHash": "a3e61f691176f128f6a1f045ae8b64c04dd1b2106264b237bb4870cf7f370c05",
          "support": [
            {
              "sourceId": "neon-docs",
              "startLine": 1,
              "endLine": 1,
              "sourceHash": "b2f7c5f7a104f2ba05db2244da830e04a29ae9c05b186bb353b639869db38852",
              "spanHash": "e86eee3060a681415d8add7349b6735bff75057b70fb1f1210631bde41a0f4a7"
            }
          ]
        }
      }
    ],
    "limitations": [
      "Synthetic fixture data; no live research or model inference occurred."
    ],
    "review": {
      "status": "supported",
      "sections": [
        {
          "id": "summary",
          "assessment": {
            "verdict": "supported",
            "reason": "Explicitly labeled synthetic fixture content.",
            "method": "fixture",
            "callId": "3ea1e62a-cea1-43fe-8074-a42022eb6156",
            "checkedAt": "2026-09-11T18:10:12.450Z",
            "claimHash": "7a08acc679c8f2d2df6c60a2625e0c36a8071c82a7a5110a2fbf3a2547707085",
            "support": [
              {
                "sourceId": "neon-docs",
                "startLine": 1,
                "endLine": 1,
                "sourceHash": "b2f7c5f7a104f2ba05db2244da830e04a29ae9c05b186bb353b639869db38852",
                "spanHash": "e86eee3060a681415d8add7349b6735bff75057b70fb1f1210631bde41a0f4a7"
              }
            ]
          }
        },
        {
          "id": "section-1",
          "assessment": {
            "verdict": "supported",
            "reason": "Explicitly labeled synthetic fixture content.",
            "method": "fixture",
            "callId": "3ea1e62a-cea1-43fe-8074-a42022eb6156",
            "checkedAt": "2026-09-11T18:10:12.450Z",
            "claimHash": "f3473241a7370a65cc04a827c2f062be9c061949af98fb48da00e4d90e6ff000",
            "support": [
              {
                "sourceId": "neon-docs",
                "startLine": 1,
                "endLine": 1,
                "sourceHash": "b2f7c5f7a104f2ba05db2244da830e04a29ae9c05b186bb353b639869db38852",
                "spanHash": "e86eee3060a681415d8add7349b6735bff75057b70fb1f1210631bde41a0f4a7"
              }
            ]
          }
        },
        {
          "id": "section-2",
          "assessment": {
            "verdict": "supported",
            "reason": "Explicitly labeled synthetic fixture content.",
            "method": "fixture",
            "callId": "3ea1e62a-cea1-43fe-8074-a42022eb6156",
            "checkedAt": "2026-09-11T18:10:12.450Z",
            "claimHash": "f3473241a7370a65cc04a827c2f062be9c061949af98fb48da00e4d90e6ff000",
            "support": [
              {
                "sourceId": "neon-docs",
                "startLine": 1,
                "endLine": 1,
                "sourceHash": "b2f7c5f7a104f2ba05db2244da830e04a29ae9c05b186bb353b639869db38852",
                "spanHash": "e86eee3060a681415d8add7349b6735bff75057b70fb1f1210631bde41a0f4a7"
              }
            ]
          }
        },
        {
          "id": "section-3",
          "assessment": {
            "verdict": "supported",
            "reason": "Explicitly labeled synthetic fixture content.",
            "method": "fixture",
            "callId": "3ea1e62a-cea1-43fe-8074-a42022eb6156",
            "checkedAt": "2026-09-11T18:10:12.450Z",
            "claimHash": "f3473241a7370a65cc04a827c2f062be9c061949af98fb48da00e4d90e6ff000",
            "support": [
              {
                "sourceId": "neon-docs",
                "startLine": 1,
                "endLine": 1,
                "sourceHash": "b2f7c5f7a104f2ba05db2244da830e04a29ae9c05b186bb353b639869db38852",
                "spanHash": "e86eee3060a681415d8add7349b6735bff75057b70fb1f1210631bde41a0f4a7"
              }
            ]
          }
        },
        {
          "id": "section-4",
          "assessment": {
            "verdict": "supported",
            "reason": "Explicitly labeled synthetic fixture content.",
            "method": "fixture",
            "callId": "3ea1e62a-cea1-43fe-8074-a42022eb6156",
            "checkedAt": "2026-09-11T18:10:12.450Z",
            "claimHash": "f3473241a7370a65cc04a827c2f062be9c061949af98fb48da00e4d90e6ff000",
            "support": [
              {
                "sourceId": "neon-docs",
                "startLine": 1,
                "endLine": 1,
                "sourceHash": "b2f7c5f7a104f2ba05db2244da830e04a29ae9c05b186bb353b639869db38852",